{
  "$schema": "http://json-schema.org/draft-07/schema#",
  "$id": "https://github.com/Flaredashboard/tso-registry/src/singleProviderSchema.json",
  "title": "Tso provider static data schema",
  "description": "Schema for single tso data",
  "definitions": {
    "baseTso": {
      "type": "object",
      "required": ["chainId", "address", "epoch"],
      "properties": {
        "address": {
          "type": "string",
          "description": "The checksummed address of the FTSO provider on the specified chain ID",
          "pattern": "^0x[a-fA-F0-9]{40}$",
          "examples": ["0x7d0F24d863961e7C51C28A3eC092C96239FBD05e"]
        },
        "epoch": {
          "type": "number",
          "description": "The first epoch where the TSO began submitting",
          "minimum": 0,
          "examples": [10]
        },
        "claim_addresses": {
          "type": "array",
          "items": {
            "type": "string",
            "pattern": "^0x[a-fA-F0-9]{40}$"
          },
          "description": "The addresses that the TSO provider is claiming the rewards to",
          "examples": [
            [
              "0x7d0F24d863961e7C51C28A3eC092C96239FBD05e",
              "0x7d0F24d863961e7C51C28A3eC092C96239dd00ff"
            ]
          ]
        }
      }
    }
  },
  "type": "object",
  "properties": {
    "name": {
      "type": "string",
      "description": "The name of the TSO provider",
      "minLength": 2,
      "maxLength": 32,
      "pattern": "^[ \\w.'+\\-%/À-ÖØ-öø-ÿ:&\\[\\]\\(\\)]+$",
      "examples": ["Cool Oracle Name"]
    },
    "website": {
      "type": "string",
      "description": "A URI to the TSO provider website. Must use HTTPS",
      "maxLength": 150,
      "pattern": "^https://[A-Za-z0-9/#.-]*[^/]$",
      "examples": ["https://github.com/"]
    },
    "twitter": {
      "type": "string",
      "description": "A URI to the TSO provider twitter. Must use HTTPS",
      "maxLength": 150,
      "pattern": "^https://twitter.com/[A-Za-z0-9/_]*[^/]$",
      "examples": ["https://twitter.com/dashboard_flare/"]
    },
    "members": {
      "type": "number",
      "description": "Number of members running the TSO",
      "minimum": 1,
      "examples": [3]
    },
    "country": {
      "type": "string",
      "description": "Country where the headquarters are located",
      "maxLength": 20,
      "examples": ["Australia"]
    },
    "nodes": {
      "type": "number",
      "description": "Number of nodes that the team is running on both chains",
      "minimum": 0,
      "examples": [4]
    },
    "categories": {
      "type": "array",
      "description": "Categories where the TSO is building their products",
      "items": {
        "type": "string",
        "enum": ["NFT", "DeFi", "Metaverse", "Wallets", "Gaming", "Utilities"]
      },
      "examples": ["NFT"]
    },
    "description": {
      "type": "string",
      "description": "The description of the TSO provider",
      "minLength": 10,
      "maxLength": 200,
      "pattern": "^[ \\w.'+\\-%/À-ÖØ-öø-ÿ:&\\[\\]\\(\\)]+",
      "examples": ["description of the cool oracle"]
    },
    "logoURI": {
      "type": "string",
      "description": "A content URL for this TSO provider logo asset",
      "pattern": "^(ipfs:|https:)//[A-Za-z0-9/#.-]*[^/]$",
      "examples": ["ipfs://QmQqeBKAubYHyhJZ7QQzfDmWkxhrnCFmrQKxha4cwKTouC"]
    },
    "signature": {
      "type": "string",
      "description": "The public signature of the provider",
      "pattern": "^[a-fA-F0-9]*$",
      "examples": [
        "123456789123456789123456789123456789123456789123456789123456789123456789"
      ]
    },
    "general": {
      "type": "string",
      "description": "The general information of the TSO provider (e.g. long description of TSO)",
      "minLength": 10,
      "maxLength": 5000,
      "examples": ["general information about the cool oracle"]
    },
    "infrastructure": {
      "type": "string",
      "description": "The information about the infrastructure of the TSO provider",
      "minLength": 10,
      "maxLength": 5000,
      "examples": ["infrastructure information about the cool oracle"]
    },
    "safeguards": {
      "type": "string",
      "description": "The information about the safeguards of the TSO provider",
      "minLength": 10,
      "maxLength": 5000,
      "examples": ["safeguards information about the cool oracle"]
    },
    "availability": {
      "type": "string",
      "description": "The information about the availability of the TSO provider",
      "minLength": 10,
      "maxLength": 5000,
      "examples": ["availability information about the cool oracle"]
    },
    "tooling": {
      "type": "string",
      "description": "The information about the tooling of the TSO provider",
      "minLength": 10,
      "maxLength": 5000,
      "examples": ["tooling information about the cool oracle"]
    },
    "products": {
      "type": "array",
      "items": {
        "type": "string",
        "pattern": "^https://[A-Za-z0-9/#.-]*[^/]$"
      },
      "description": "URLs of the products that the TSO provider has built. Must use HTTPS",
      "examples": [["https://flaredashboard.io/"]]
    },
    "stso_info": {
      "allOf": [
        {
          "$ref": "#/definitions/baseTso"
        },
        {
          "type": "object",
          "properties": {
            "chainId": {
              "type": "integer",
              "description": "The chain ID (14: Flare, 19: Songbird) where this TSO provider is submitting prices",
              "enum": [19],
              "examples": [19]
            }
          }
        }
      ]
    },
    "ftso_info": {
      "allOf": [
        {
          "$ref": "#/definitions/baseTso"
        },
        {
          "type": "object",
          "properties": {
            "chainId": {
              "type": "integer",
              "description": "The chain ID (14: Flare, 19: Songbird) where this TSO provider is submitting prices",
              "enum": [14],
              "examples": [14]
            }
          }
        }
      ]
    }
  },
  "anyOf": [
    {
      "required": ["stso_info"]
    },
    {
      "required": ["ftso_info"]
    }
  ],
  "required": ["name", "description", "website", "logoURI", "members", "country", "nodes", "categories"],
  "additionalProperties": false
}
