{
  "name": "FTSO AU",
  "website": "https://ftso.au",
  "twitter": "https://twitter.com/ftso_au",
  "description": "Providing value to the Flare ecosystem and it's participants. ",
  "general": "We provide accurate and reliable price feeds to the Songbird & Flare network and a transparent, incentivised, risk-free delegation service. We run observation and validation nodes, as well as underlying chain nodes, to support attestation services. FTSO AU are an active member of the Flare ecosystem.",
  "availability": "We use best in class global data centres, our SLA guarantees a Monthly Uptime Percentage of at least 99.99%. Our pricing data is real-time, accurate and robust.",
  "logoURI": "https://www.ftso.au/img/logo.png",
  "members": 2,
  "country": "Dubai",
  "nodes": 10,
  "categories": ["Utilities"],
  "ftso_info": {
    "chainId": 14,
    "address": "0x4990320858AE3528B645C60059281a66C3488888",
    "epoch": 1
  },
  "stso_info": {
    "chainId": 19,
    "address": "0x499017adb21d6f70480e4e6224cf4144071c1461",
    "epoch": 1
  }
}
